title,category
바이든  재향군인의 날  참전용사는 미국의 중추  엄청난 빚져 ,World
  최연소 의원   도보다리  걷고 이재명 윤석열 면담,World
  쇼핑 축제 맞나 가장 조용했던  클릭 ,World
 테슬라 대항마  리비안 화려한 상장,World
나이키 선물 못 받을 수도 있다  베트남에 달린 성탄절 운명,World
모더나  심근염 발생 위험  모더나가 화이자보다  배 높다  인정,World
글로벌 에너지 대란에 전 세계에서 불붙는  원전 확대  논란,World
시진핑 신의 한수   바이든을 베이징 올림픽에 초청 ,World
유럽의약품청  셀트리온 코로나 항체치료제 승인 권고,World
 시진핑 업적 장황하게 나열  덩샤오핑은 격하 ,World
머스크  주식 진짜 팔았다 추가 매도에 무게,World
 속보  뉴욕 증시  인플레 우려에 혼조 마감   다우        나스닥       ,World
모더나 백신  심근염 발생 화이자의  배  돌파 감염은 적다 ,World
아베  자민당 최대 파벌 복귀 첫 일성  헌법 개정하겠다 ,World
  물가 상승률   년 만에 최고   그린플레이션  글로벌 요동,World
마세라티 들이받았다고 대학생 폭행해 중태 빠뜨린  대만 금수저 ,World
 아태 냉전 안돼  시진핑 경고에 미  신냉전 안 갈 선택권 있다 ,World
모더나 백신  심근염 발생 화이자의  배  돌파감염은 적다 ,World
미 외신  시진핑  베이징올림픽에 바이든 초청할 듯 ,World
벨라루스  난민 내보내려 국영 여행사 통해 패키지상품 팔아,World
북유럽은 여성 총리 전성시대,World
치솟는 물가 감당 못해   선진국도 개도국도 굶는 사람 급증 ,World
시진핑  스스로    대 지도자 올라   연임 길 열었다,World
 남북 여성 힘 합치면 한반도 평화   서 탈북민 참여 동포 대화,World
알리바바 쌍십일    조 매출 찍었지만 성장세 꺾여 종합 보 ,World
모더나 백신  심근염 발생 화이자의  배    돌파감염은 적다 ,World
쿠데타 수단 군부  새 주권위원회 구성 권력장악 가속도,World
유럽의약청 자문위  셀트리온 코로나   치료제  렉키로나  승인 권고 종합 ,World
모더나  우리백신 심근염 위험 화이자  배  돌파감염은 적다 ,World
 시진핑  베이징올림픽에 바이든 초청할 듯  CNBC,World
머스크  공언한대로 주식 매각      아닌   ,World
방한    최연소  상원의원  이재명 윤석열 차례로 면담 예정,World
EMA  한국 셀트리온 코로나 항체치료제  렉키로나  승인 권고 ,World
유럽의약청 자문위  셀트리온 코로나   치료제  렉키로나  승인 권고,World
홍콩 항공사 조종사 학부모 확진에 한 국제학교 전면 폐쇄,World
 연임 터닦은 시진핑  공동부유 미중관계 대만  난제 ,World
유럽의약청  셀트리온 코로나   치료제 승인 권고 종합 ,World
유럽의약품청  셀트리온 코로나 항체치료제 렉키로나 승인 권고  종합 ,World
트럭운전사에 패배 인정한  민주당 지역 거물  공화당의 물결 ,World
 우린 더 기다릴 수 없습니다  물속서 연설한 장관,World
일본 새 외무상  한 일관계 이대로 방치 못해  당국간 의사소통 할 것 ,World
시진핑의 중국  문화대혁명까지 긍정,World
뉴욕증시  인플레이션 경계 속 혼조세 출발,World
  세 제자와 성관계 혐의 임신한   대 여교사 풀려난 이유,World
벨라루스  제재 경고한 EU에  가스공급 차단  위협,World
 민주주의는 강하다  테러 재판에 증인으로 나선   전 대통령,World
 인 통치체제 공고화하나  시진핑 핵심  강조한 역사결의,World
전문가  중국  중전회로 시진핑 장기집권 정지작업 마쳐 ,World
   중전회  천   여자 공보   분의  은 시진핑 집권  년,World
    년만에 역사결의   대 지도자 된 시진핑 장기집권 길 열다 종합 보 ,World
유럽의약청  셀트리온 코로나 항체치료제  렉키로나  승인 권고,World
마오쩌둥 반열 올라선 시진핑  장기집권 명분 완성,World
일본 코로나 신규감염    명 사흘째    명대   누적    만    명,World
대만 코로나 신규환자  명  돌파감염   명   이틀째 사망자 없어,World
  시진핑  베이징 올림픽에   바이든 초청할 수도,World
남아공 마지막 백인 대통령 데 클레르크 별세 종합 ,World
  드디어 유럽에 국경 열었는데 유럽은 지금  코로나 진원지로 ,World
중국 코로나   신규감염   명 본토   명   무증상   명,World
  공산당 시진핑 중심 새로운 역사 결의 종합 ,World
시진핑  마오쩌둥 등샤오핑 반열에 장기집권 길 열어,World
 중국  대 지도자  반열 오른 시진핑  대외 정치 속도낸다,World
정상회담 앞둔 미 중  기후변화 협력  공식화 ,World
홍콩 아파트값  이 정도였어   평당  억    만원  아시아 최고가 경신,World
세계 경제 덮친  인플레  공포  더 무서운 건 불확실성 ,World
 포커스  세계 덮친  물가 상승  공포 한은  높은 물가 지속 ,World
마오쩌둥 반열 오른 시진핑  남은 건  황제 즉위식 ,World
시진핑  마오 덩 반열 격상   공산당    년 역사 세번째 결의 채택 종합 ,World
 종합 마오쩌둥 반열 오른 시진핑    년만 새 역사 결의,World
인니서 성인 남녀 공개 회초리질 이유 알고 보니  간통죄 ,World
중국  역사 결의  채택 시진핑   대 지도자 로 우뚝,World
 고구마도  사회적 거리두기  실시    치명적 병충해 피해,World
 너무 뜨겁잖아  매장 점원에 스프 끼얹은  여성  영상 ,World
필리핀 두테르테 딸  당적 변경 대선 출마 여지 남겨,World
시진핑  마오쩌둥 덩샤오핑 반열에 장기집권 길 열어,World
 백신 맞으면 성매매 무료    하다하다 이런  방역 이벤트 까지,World
  년 만의  역사결의  시진핑   대 영도자 반열에,World
미국 물가   년 만에 최대폭 상승  전 세계 물가 비상 ,World
 미국  반도체 자료제출 요구 목표는 삼성 TSMC 두 곳뿐 ,World
 시진핑 사상은 중국 정신의 정수  최소   년 장기집권 작업 끝났다,World
  북동부    년 만에 기록적 폭설 산간엔  m 쌓여,World
시진핑  장기집권 최대 과제는  대만과 통일  무력이냐 평화냐,World
   대 지도자 반열 오른 시진핑  중국몽  향해 돌진 종합 ,World
 시진핑 사상은 중화문화의 정수       년만의  역사결의 ,World
 집중취재M   민간 기업 임대 주택 몰수하라  폭발한 베를린 시민들,World
중 공산당  번째  역사 결의  시진핑   세대 영도자  입지 굳혀,World
  네이멍구   시간 연속 폭설 건물  천여 채  풀썩 ,World
마오 덩만 했던 역사결의 채택 시진핑  장기집권  포석,World
 뉴스추적  마오쩌둥 되는 시진핑 역사 결의는 어떤 의미인가,World
남편 살인 청부한 일본 여성  육아 제대로 안해서 ,World
중국 공산당 세 번째  역사 결의  채택  시진핑 사상은 시대적 정수 ,World
중국    년 만의 역사 결의 시진핑 장기집권 준비 마쳤다,World
     년 만에 역사결의 채택  공산당  시진핑 사상  중국 정신의 정수 ,World
 항공자위대   공군과 센카쿠 열도 주변서 수색구조훈련,World
폴란드 벨라루스 난민 사태   서방 vs 러시아  전면전 치닫나,World
 열차  분 지연 에 기관사 급여     원  삭감한   철도회사,World
  보   역사결의  시진핑 핵심지위  중화민족 부흥에 결정적 의미 ,World
  보   년 만의  역사 결의  의결  마오쩌둥 반열 오른 시진핑,World
 시황제  시진핑 장기 집권 길 열었다   연임 수순,World
사망자  명 일본 미스터리 확진자 급감 설명 못 해,World
중국    년만에 새 역사 결의 채택  시진핑 사상  정신 정수 ,World
지구촌 덮친  인플레 쓰나미   세계 금융시장도 출렁,World
독일 신규 확진  만 명 하루 새  만 명 늘어 사상 최다,World
벨라루스 vs 폴란드 EU  이주민 갈등   러 나토로 확대되나,World
벨라루스 난민 사태에 유럽 국경 긴장 러시아가 배후 ,World
  개헌 세력  다수  힘 받은 기시다 총리 개헌  시동 ,World
미 소비자물가   년 만에 최고로 급등  인플레 공포 ,World
  파키스탄   아프간 사태해결  신경전 국제회의 개최 경쟁,World
 속보 중국   년만에 역사결의 채택  시진핑 사상  정신 정수 ,World
   생존율 뚫었다   주 만에 세상 나온    g 아기  기네스북 ,World
 달고나처럼 달콤  오징어 게임 위하준    섹시 남성   인,World
러시아  청소년용 코로나 백신  스푸트니크 M   상 개시,World
  물가 상승률   년 만에 최고  급속히 확산되는  인플레 공포 ,World
  새 외무상도  한국이 해결책 제시해야    관계 개선 기대 어려워,World
다이아만    개 마리 앙투아네트 최애 팔찌    억에 낙찰,World
러시아  청소년용 코로나   백신  스푸트니크 M   상 개시,World
중국  블링컨 대만 관련 발언에  언행 조심하라  경고,World
 기시다 아베 동맹  균열 가속화     외무상   과 관계개선 노력 ,World
 조용한  쌍십일 쇼핑축제 실시간 매출 공개 안한 알리바바 종합 ,World
 중국  대 지도자  반열 오른 시진핑  대외 정치 속도낸다,World
 ET      개월 만에 외국인에 빗장 풀었다 경제 효과는 ,World
세계 최초로  코로나 대비 훈련  시행하는 이스라엘    전쟁 대비와 같은 방식,World
 뚜껑 녹았잖아   식당 직원 얼굴에 수프 들이부은 손님,World
일본차 금지한  골프장에 발끈  언론  카트는 일본산 ,World
 World Now 영상  뉴질랜드 총리 생방송 중  엄마   살 딸  브리핑 난입 ,World
참치 없는 참치샌드위치  미국 써브웨이  황당 소송전,World
아시아서 가장 비싼 아파트  평 당 얼마    홍콩서 거래,World
 주식 팔까  물었던 머스크  진짜   억 어치 팔았다,World
 나도 팔아야 하나   머스크   일간 테슬라    만주 팔았다,World
 자민 최대 파벌  아베파  시동  헌법 논의 선두에 서자 ,World
 제  테슬라  리비안 화려한 데뷔   시총      억 로 GM 포드 제쳐,World
러시아  청소년용 코로나 백신  스푸트니크 M   상 개시,World
    반도체 에너지 양자 대화 협력 틀 확대 격상 합의,World
 참치 없는 참치샌드위치라니  미국서 써브웨이 소송전,World
시진핑  마오쩌둥 으로 격상       관계설정    외교 최대 난제될 수도,World
루마니아서 또 코로나   병원 화재 환자  명 사망,World
 여기는 중국    시간   분 도보로 출근했다      역사상 최악의 폭설로 대혼란,World
중국  유학생에 문 여나 외국대 분교  복학준비  안내메일,World
  요소 수출 금지에 대만도 비상    톤당 가격  배 폭등   비료 때문에 ,World
인플레 공포에 암호화폐 금 부상  위험 회피 심리 ,World
 테슬라 대항마  리비안 상장  시총    조원 포드 제쳐,World
미러  우크라이나 두고 갈등고조 제 의 크림반도 사태 ,World
 인플레는 일시적 내년이면 완화될 것 ,World
 시진핑 사상은 중화문화 정수   공산당   장기집권 길텄다,World
머스크  테슬라 주식  조 천억원 진짜 팔았다,World
머스크  테슬라 주식   억 달러 어치 판매 시총  조달러 아래로 휘청,World
아베  자민당 최대 파벌 복귀 첫 일성  개헌 논의 주도하자 ,World
 자동차 덕후  MIT 박사가 일냈다  테슬라 대항마  리비안 상장 돌풍,World
뉴질랜드 총리 생방 도중  엄마    살 딸의 귀여운 난입,World
마세라티 들이받았다고 야구방망이 폭행  혼수상태 ,World
 너무 뜨겁잖아  수프 뚜껑 열더니 점원 얼굴에  확 ,World
전세계 확진자    가 유러피언   마스크 잘못 벗었다 경제마저 휘청,World
중국   월 주담대 증가  부동산 돈줄 조이기 완화 신호 ,World
텐센트    년 만에 분기 이익     미성년자 게임 규제 영향 ,World
   근원물가    넘을 수도  Fed 금리인상 시계 더 빨라질 듯,World
유럽이 어쩌다 코로나 진앙지로 부스터샷 등 백신에 사활,World
톱스타 이정재에  인기 얻으니 어떠냐  미국 기자 황당 질문,World
  대게 한 마리     만원에 낙찰 세계 신기록 타이,World
 제 헝다  부동산업체 카이사 디폴트 우려 고조,World
 일상적인 감기  코로나   막는 데 도움 될 수도   연구,World
뉴질랜드 총리 생방송 도중  엄마    살딸  브리핑 난입 ,World
 김정은 만나겠다   한국과 소통 가속  아베와 거리 두는  기시다 외교 ,World
머스크  테슬라 주식 진짜 팔았다,World
우주여행 역사   년 우주로 간 인간    명 돌파,World
주식 팔까  물어본 머스크  테슬라 주식  조    억원어치 매각 종합 보 ,World
  주 만에 태어난      조산아   개월 버텨내 기네스 기록,World
 마세라티 에 사고 낸 대만 청년 집단 폭행한 대만 금수저     회사 휘청,World
구글  AI로 중풍 치매 환자 말 알아듣는 앱 개발중,World
벨라루스  국경 난민 사태  러시아 폭격기까지 등장,World
일본 첫 부스터샷 승인   월 의료진부터  화이자  추가접종,World
중국 고립 자초해 중국은 물론 세계경제도 위기,World
시진핑 띄우고 마오 깎아내린     대 영도자  낯뜨거운 찬가,World
유엔안보리  미얀마 군정 폭력 즉각 중단해야    개국 전원찬성,World
양안 갈등 속 대만출신 홍콩 대학총장  명 잇따라 사의,World
현대차 인도네시아 공장서 생산한  크레타  실물 첫 공개,World
 평당  억    만원  아시아서 가장 비싼 아파트는,World
 유명해지니 어때      리포터 질문에  갑론을박 ,World
스테이크 계란 시리얼까지 비싸지는  식료품값,World
자민당 최대파벌 수장 된 아베의 첫 일성  개헌 논의 선두에 ,World
보잉  에티오피아    맥스 추락사고 책임 인정,World
 내가 판다고 했지    머스크  테슬라 주식 던졌다,World
 Pick   m 악어가 다가와  덥석  주머니칼 휘둘러 살아남은 남성,World
새로운 변이 대비는 군사훈련처럼 이스라엘  코로나   워 게임 ,World
 영상  대만 노렸나 중국 최첨단 무인기  비상하는 용 ,World
 월드피플    기네스 올랐어요    주차에 태어난    g 초조산아의 기적,World
일본  머크  먹는 코로나치료제     만명분 구매 합의  한국은 ,World
바이든 시진핑 첫 회담 전 깜짝  훈풍  기후대응 공동선언 발표,World
홍콩서 아시아 최고 아파트값 경신  평당  억    만원 ,World
베이징 코로나   확산 폭설 동계올림픽 계획 차질 우려,World
  기자  유명해지니 어때   질문에 이정재 답변은 ,World
점입가경 벨라루스 이젠  독일 난민 입국 티켓 팝니다 ,World
 전기트럭 이  전통트럭  제쳤다  리비안  GM 포드 누르며 증시 입성,World
우주여행 역사   년 우주로 간 인간    명 돌파,World
기후회담에서 무시된 세계의  재앙적인  물 위기  가장 가난한 사람들이 가장 큰 고통 ,World
소득 제자린데 집값 두배 뛴  ,World
 뚜껑 녹았잖아  직원 얼굴에 수프 들이부은 진상 손님,World
머크  먹는 코로나   치료제  빈부국 시차없이 공급할 것 ,World
아베 아소 반대 뚫은 하야시  외상  한일 갈등해법   이 내야 ,World
우주여행 역사   년 우주로 간 인간    명 돌파,World
 촬영장 총기사고  알렉 볼드윈  징벌적 손해배상 피소,World
  신임 외무상   과 소통 강화 강제징용은 한국이 해결해야 ,World
 주식 팔까   트위터 설문했던 머스크  테슬라 주식   억달러어치 진짜 팔았다 종합 ,World
  언론   일본이 우방국가 맞냐 는 이재명에  불신과 경계심 드러냈다 ,World
홍콩에 평당  억    만원 아파트 등장   아시아 최고가 ,World
 위드 코로나  확산 여파에 디즈니  가입자수   분의  토막 ,World
경기 우려에도 수출호조 고금리에  위안화  가치 고공행진,World
 현재로선 태양 바람 원자력이 최선의 재생에너지  WSJ,World
머크  코로나   치료제  빈부국 시차없이 공급하겠다 ,World
 머리만 필사적으로 때렸다   마세라티  들이받은 대학생 폭행한 대만 금수저의 최후,World
하야시 외무상   과 소통 강화    기시다 아베 정치 대립 본격화,World
 테슬라  팔까  투표한 머스크   일간  조원어치 매각 종합  ,World
 World Now 영상  코로나   백신 맞은 미국 수족관 해달,World
중국 요소 수출 줄이자 한국 대만 인도  요소대란 ,World
생존율    극복   주만에 태어난      미숙아 기네스북,World
 뉴스외전 뉴스 스토리   주식 팔까   물었던 머스크 진짜 매각,World
집권   년 시진핑의 명암 경제성장했지만 국제사회서 고립,World
   대만 향한 무력시위  훈련  아닌  실전     시간 전투 준비 의미 ,World
    위기의 부동산업체들 자산 매각 위해 규제 완화 검토 ,World
   주식 국채 매도세 드디어 인플레 공포에 반응했다 ,World
대만도  요소 대란   톤당 가격 전년보다  배 폭등,World
 코로나   모든 변이를 차단하는 항체가 발견됐다 ,World
 평당    억  홍콩서 아시아 아파트 최고가 경신    주차장만   억 ,World
  신임 외무상  한 일 관계 개선 의지 과거사 해결은 한국 몫 ,World
   대만겨냥 무력시위 공개하며  훈련  표현 빼  실전 강조 ,World
 메타버스 로 주가 급등 기업 조사 나서는   투자 열기 우려,World
 물가 싼 일본  시대 끝나나     수입물가 자국 내 제품 반영 현실화,World
대만 방문   의원단  안보현안 논의 밀착 과시,World
일본  화이자 부스터샷 승인   월 의료진부터 접종 시작,World
머스크  팔로워랑 약속 지켰다      억 달러 어치 주식 매각 ,World
 지분 팔까   트윗했던 머스크  테슬라 주식  조    억원어치 매각,World
 내 남편 죽여달라  트위터에 청부살인 글 올린   대    글로벌  ,World
중국 내몽골  얼음도시 로 변했다      년만에 최대 폭설 ,World
코로나 사망자 연일 신기록  유럽  진짜 비상상황 맞았다 ,World
 평당    억  홍콩 아파트값   최고가 경신,World
유럽이 어쩌다 코로나 진앙지로 부스터샷 등 백신에 사활,World
 중국판 인스타  샤오홍슈  몸값   조원   대신 홍콩 상장 추진,World
벨라루스에 무슨 일 제재하려는 EU  폭격기 지원하는 러시아,World
 월드리포트  규제에 공산당 행사에 달라진 중국 쌍십일 쇼핑 축제,World
 환불해 달라고   종업원 얼굴에 수프 냅다 뿌린  여성,World
반도체 정보 제출  일회성  강조한     반응 등 주목,World
 마세라티  들이받았다고 대학생 폭행해 혼수상태 빠뜨린 금수저  공분 ,World
  정부  먹는 코로나   치료제    만명분 구매 합의,World
아시아에서 가장 비싼 아파트는  홍콩  평당  억 천만 원  기록 경신,World
스페이스X  크루   유인우주선  인듀어런스  발사 성공,World
평당  억    만원  홍콩서 아시아 아파트 최고가 경신,World
   대씩 채찍질  인도네시아 불륜 남녀  공원서 공개 태형식,World
대만 방문  의원 대표단    위협  등 국방문제 협의,World
미국 물가 고공행진에 연준 내년 여름쯤 금리 인상 가능성 커져,World
  헝다리스크 언제까지 디폴트 위기 또 한번 넘겨,World
평당  억    만원 홍콩 아파트값 아시아 최고가 경신,World
 일본차 출입금지    골프장에  언론  저러다 말겠지 ,World
중국 내몽골  얼음도시 로 변했다      년만에 최대 폭설 ,World
 World Now 영상  폭설 뚫고 달리는 열차 중국 내몽골   년만에 최대 폭설,World
홍콩서 평당  억    만원 아파트 팔려 아시아 최고가 경신,World
비트코인보다 이더리움 고공행진    년 내 뒤집힐 수도 ,World
미국   년만에 최고 인플레이션  이유는  그린플레이션 ,World
한 세대 만의 인플레이션에 긴장하는 미국   월 물가상승   년 만에 최고,World
드론 암살시도 난민 밀어넣기  하이브리드 전쟁  시대 도래하나,World
  소비자물가   년만에 급등 금리인상 빨라지나,World
미중  기후위기 대응 협력  깜짝 선언     어떻게 가능했나,World
테슬라 대항마  리비안  돌풍 상장 첫날 GM 포드 제쳐,World
 전기차 부품 핵심원료 희토류 미얀마산 가능성  군부 자금원 ,World
기후변화는 합의  핵심사안은 대립       정상회담 앞두고  기 싸움 ,World
 일본은 우방국가인가  의구심  이재명 발언에   언론들 경계,World
   기후변화  깜짝  선언에 COP   술렁   정상회담에도 훈풍 ,World
 다시 원전    무엇이 마크롱을 변심케 했나,World
 남편 죽여줄 사람 구해요  SNS에 청부살인업자 모집한  여성,World
테슬라 vs 리비안 로이터가 살펴본 닮은 듯 다른  가지,World
 평당  억 천만원  홍콩  아시아 최고 아파트값 경신,World
페루서 잇달아 고대 유적 발견 고고학계 흥분 중,World
   소비자물가 상승률   년 만에 최고   기준금리 인상 빨라지나 ,World
 주식 팔까  물어본 머스크  테슬라 주식  조 원 가까이 팔아치웠다,World
    조원 인프라법 서명 앞두고 축배 든 바이든    더 큰 산 남았다 ,World
 백신 맞으면 매춘 무료  유럽선 하다하다 이런 방역 이벤트,World
칠레  아타카마 사막의  옷 언덕  환경 파괴 우려,World
중국   년만에 역사결의 시진핑 장기집권 명분 담을 듯,World
일본서 하늘 나는 오토바이 개발 비화 상용화는 ,World
미중   일 첫 정상회담 시진핑  냉전 회귀 안돼 ,World
폴란드 벨라루스 국경 난민 분쟁  EU 제재에 복수하려는 것 ,World
대만 방문 미 의원단   중국 위협  등 협의 밀착 과시,World
 기시다  하야시 외무상 카드 뽑아든 이유는,World
미 상무장관  한미  반도체 공급망 위기 해결 위해 협력키로  종합 ,World
 한국 게 섰거라    정부  작정하고 반도체 산업 지원한다  정영효의 일본산업 분석 ,World
 오겜 으로 대박난 넷플릭스 디즈니 는  주춤 ,World
미 소비자물가   년만 최대폭        예측 어렵다 ,World
  네이멍구  최고  m 폭설   축사  천여 채 붕괴,World
       세 백신 접종  벌써   만 돌파 이스라엘도 곧 돌입,World
흰 독성 거품 뒤덮인 강 알고도 인도인들이 몸 담그는 이유,World
미국 물가   년 만에 최대 휘발유는 최고치,World
헝다  유예기한 달러채 이자 지급 디폴트 간신히 면해 종합 ,World
 의  오커스  겨냥한  시진핑  냉전시대 대립으로 회귀 안돼 ,World
 주식 팔까  물어본 머스크  테슬라 주식  조 원 가까이 팔아치웠다,World
    로우키 급선회   첫 정상회담 앞 숨고르기,World
    월물가           년만에 최고치 ,World
 제  테슬라  리비안  상장 첫날 포드 시총 추월 GM  위협 ,World
 인기 얻으니 어때   이정재 향한  기자 질문에 갑론을박,World
미국 물가 고공행진 연준 내년 여름께 금리인상 가능성 커져,World
중국 광군제 너무 조용하다 했더니  중전회에 묻혀,World
벨라루스 난민 사태  러 EU 싸움 확대되나 폭격기까지 등장,World
중국 내몽골   년만에 최대 폭설  얼음도시로 변해 ,World
 테슬라  팔까요  묻던 머스크   조    억원 어치 진짜 매각,World
엄마아빠와 줄 선 아이들  서 어린이   만명 백신 맞았다,World
 구독자    만 비결이요     남미서 한류 콘텐츠로 대박난 황진이씨,World
원래 코로나 면역 있던 사람도 있었다  새 백신 표적 발견 ,World
진짜로 테슬라 주식 판 머스크  조     억 규모,World
중국   메타버스  주가급등 회사들 조사  투기행위 경계 ,World
삼성의 애플 저격     광택용 천  우린 공짜 ,World
규제의 시대 첫  쌍십일   눈에 띄지 말자  숨죽인 알리바바,World
국내 출시 앞둔 디즈니   가입자 넷플릭스 절반도 안돼,World
 남편 죽여주면 돈 줄게      대 여성  SNS 청부살인의 결말,World
오징어게임 배우 위하준   올해 가장 섹시한 남자    인 리스트 올라,World
유럽  백신 접종률에 희비 갈렸지만 겨울 앞두곤 모두 긴장,World
    m 상공 열기구에 두 발로 섰다    두 팔에 든 숫자 의미는 ,World
 언론  한국 정부 무능    우리 덕에 요소수 위기 넘겨 ,World
확진자 유독 늘어나는 유럽   차 대유행 접어들었다 ,World
독일 신규확진  만 명 육박    만 명 추가 사망  경고,World
 공동 개발자 이름 뺐다  모더나   정부와  백신 특허  갈등,World
드론 암살시도 이주민 밀어넣기  하이브리드 전쟁 이 온다,World
디즈니  스트리밍 서비스 구독자수 증가폭 둔화에  어닝 쇼크 ,World
