title,category
백신 맞고 사지 마비된   소녀 희귀 길랭 바레 증후군 진단,World
미 중 기후공동선언 채택한 날   시진핑  지정학적 소그룹 미래없다  종합 ,World
백신 미접종자  접종자 대비 감염 위험   배  사망 확률은   배  ,World
 정부  헝다그룹 해체 작업 본격화      개 도시서 진행 ,World
원래 코로나 면역 가진 사람도 있었다  새 백신 표적 발견 ,World
톱스타 이정재에  인기 얻으니 어떻냐   기자 황당 질문,World
미국 중국 인플레이션 급등할 수밖에 없는 이유  가지,World
 내년 미국 태양광 풍력 발전설비 설치 사상최대 전망 ,World
유럽  코로나 재확산 에 봉쇄조치 대신 백신 접종에  사활 ,World
 팔까 말까   머스크  입방정 아니었다 테슬라 지분   억 달러어치 매각,World
중국 올해 광군제 차분한 분위기  매출규모    조원 넘길것 ,World
IT 업계    반도체 자료 요구  다른 정부가 따라할 수도 ,World
  먹는 코로나 치료제    만회분 확보 내년  월부터 일반인 부스터샷 시작,World
기시다  아베 반대 무시하며 하야시 외무상 강행 총선 승리 발판 홀로서기 본격화,World
코로나 변이 대비 세계 첫  워 게임   이스라엘  오메가 연습  실시,World
 지구촌 Talk     일 만에 지구로 무사 귀환한 우주인들,World
 영상  스프 뜨겁다    점원 얼굴에 부어버린   여성,World
 플라스틱 스며들었잖아  직원 얼굴에 수프 부은 손님 영상 공개,World
 테슬라 주식 팔까  투표한 머스크  진짜 팔았다 종합 ,World
중국  부동산개발사 자산매각 쉽게 대출규제 완화 고려,World
   정부  헝다그룹 천천히 해체 작업 중 ,World
 당국   헝다 리스크 최소화  위해 대출규제 완화 검토,World
메타  경쟁자 MS와 손잡는다 기업용 협업플랫폼 통합,World
태국 헌재  군주제 전복 의도  개혁 움직임에  제동 ,World
우크라 벨라루스 위기 서방 러시아 신냉전 가속,World
매각 투표 진행한 머스크  테슬라 주식  조 천억원 팔아,World
 자막뉴스  섬나라 투발루 장관 수중연설  우리는 가라앉고 있다 ,World
 백신 부족  베트남  인도 코로나   백신 긴급 사용 승인,World
 오징어게임  정상 탈환   일째  위 신기록   두 달 만에 유튜브    억뷰,World
 넷플릭스 경쟁자  디즈니   신규 가입자는 넷플릭스 절반 수준,World
중국 코로나 확산에 상하이 마라톤 연기,World
인플레 우려 확산에  헤지 수단  금값 비트코인 반짝 상승,World
미  러시아에  심각한 실수 또 하지 말라  경고,World
중국  부동산개발사 자산매각 쉽게 대출규제 완화 고려,World
   헝다 또 디폴트 모면 달러채 이자 일부 지급 ,World
   머크  먹는 코로나 약  누적 감염자수만큼 확보,World
EU 벨라루스 갈등 속 전략 폭격기 띄운 러시아  무력시위 동맹관계 과시,World
중국    개 전자상거래 플랫폼 소집  쌍십일 부당경쟁 말라 ,World
중국군   정찰 공격  무인기 실전훈련 전면 투입,World
한국 상륙 마블 흥행작 대기 디즈니   가입자수 둔화 반전 승부수,World
판 커지는 동유럽 난민갈등 EU  추가 제재  vs 러  폭격기 급파 ,World
 World Now  폴란드 국경에 난민 수천명 벨라루스  난민 밀어넣기  ,World
 주식 팔까   머스크  지분   억 달러 진짜 팔았다,World
규제에 텐센트  분기 순이익    증가   년만 최저 ,World
문승욱    EU 철강 관세 합의  한국과도 상응 논의 기대 전달 ,World
 백신 부족  베트남  인도 코로나   백신 긴급 사용 승인,World
미 동아태차관보 방한  이재명 윤석열 후보 면담,World
미국 공급망 재편 가속화 기업들 대미 투자 속도내나,World
말레이  미얀마 비상사태 우려 로힝야난민   만명 수용중 ,World
  시진핑  APEC 미국 겨냥해  냉전식 소그룹 버려야 ,World
 오징어게임   유튜브    억뷰 돌파    왕좌의게임 도 제쳤다,World
IS K 테러에 식량 에너지 위기까지  아프간  지옥의 겨울  닥친다,World
