title,category
UFO인가    베이징 하늘에 나타난 핑크빛  렌즈운 ,World
알맹이 빠진  기후 총회       년   개 도시 잠긴다 ,World
벌써 GM 시총 추월  제 의 테슬라  리비안 돌풍,World
중국 선양시 등에 눈 폭탄      년 만에 최대 폭설 ,World
 BTS 공연표 경매했더니   만원     인권단체가 왜 ,World
 공동부유  눈치  성장세 꺾인   알리바바 쌍십일,World
 SNS핫피플     살 할머니의    m 질주  모든 순간이 마법   ,World
모더나  심근염 발생 화이자  배  위험보다 접종 이익 커 ,World
불륜커플이라고   인도네시아 공원서 회초리   대씩 공개 태형,World
이란  올해 아프간 난민    만명 본국으로 강제송환,World
일 도시바   개로 분할독립 인프라  디바이스 털어내고 반도체 집중,World
 마세라티 왜 들이받아    대 금수저  상대 차주 무차별 폭행,World
하루 확진  만명 넘은    백신 미접종자 실내시설 출입 제한 ,World
유럽의약품청  한국산 코로나   치료제 승인 권고,World
서유럽 곳곳 확진 신기록 백신 미접종자  봉쇄 정책  검토,World
먹었으면 어쩔뻔     억분의   확률  보석 랍스터 남다른 운명  영상 ,World
핵심은 병상 치료제    재확산  대비 분주한  ,World
몸무게    g 임신   주 초미숙아  기네스 올랐다,World
바이든    참전용사 최고수준 혜택 받게 할 것 ,World
어리둥절 남극 펭귄       밀려와  미아 된 사연,World
중국 최대 파운드리 SMIC 고위경영진 돌발인사 충격,World
 비디오머그  코로나 끝난 듯 대환장 파티 시작한 인도 근황,World
바이든표 사회복지 예산  미국 인플레이션 우려에 발목 잡히나,World
초장기집권 터닦은 시진핑  빈부격차 미중갈등 난제 산적,World
   코로나 대책  경구용 치료제    만 명분 확보 ,World
퇴근 후 문자하면 벌금 유럽 각국  연결되지 않을 권리  법제화,World
 추가 제재하면 가스관 잠글 것     난민사태  벨라루스  EU 위협,World
 백신 미접종자의 팬데믹     코로나  차 확산에  초비상 ,World
  역사결의에 타이완 홍콩 거론 타이완 반발  불가능한 정치적 주장 ,World
캐나다서    년 된 동전 발견  가장 오래됐다 ,World
벨라루스  가스 대란 오나  난민 관련 제재시 EU 공급 끊겠다 ,World
 시진핑 체제 확립  자화자찬한  공산당  정부 만족도     ,World
중국  시진핑 새시대  선언  대 지도자 반열,World
  홍색규제에 경기 급랭   공동부유 고도성장 사이 딜레마 커져,World
푸틴 등에 업은 벨라루스  EU가스관 끊겠다 ,World
모더나  우리 백신 심근염 위험  화이자  배 돌파감염보단 낫다 ,World
 위키리크스  어산지 옥중 결혼식 올린다,World
 영상     살  할머니의  이게 바로 달리기란다     m 세계기록,World
글로벌 인플레이션 공포 엄습 복합요인에 속수무책,World
 농구 도중 부딪쳤다고 이렇게 무자비한 주먹질  엄마가 부추겼다 ,World
 벌거벗었다  배꼽티  마트서 쫓아낸 직원   SNS 사진 보니,World
방사청장  KF    재협상      만족 인니 연체금 납부할 것 ,World
  시간 동안 눈 내린 중국   시간 걸어서 출근 ,World
 한국  석탄 사용으로 발생하는   인당 온실가스  세계  위 ,World
 스태그 공포  커질 땐 이 전략 월가 애널리스트 추천 투자법,World
 사람 공격하는 물고기  피라냐  브라질 남부서도 나타났다 이유는 ,World
빅테크 규제에 전력난 공급병목까지 조용했던   광군제,World
    마오쩌둥 시대처럼 시진핑 개인숭배 회귀 우려  BBC,World
바이든  치솟는 기름값에 비축유 카드  만지작 ,World
바이든       영웅들에 큰 빚  영원히 기억 ,World
 기네스북 등재    주 만에 태어난     아기 살아남아,World
중국   시진핑 사상으로 제 갈길 갈 것 ,World
 퇴근 후 연락하면 벌금  포르투갈  새 노동법 시행,World
 모든 성인에 부스터샷  바이든 구상에 CDC 국장  신중론 ,World
 영상  임신기간    주  일  몸무게    g로 태어난   남자 아기 기네스북에,World
미  유럽 동맹국에 경고  러시아의 우크라 침공 대비해야 ,World
   세 할머니 러너    m 세계 신기록   달리는 모든 순간이 마법 ,World
EU  중국 일대일로 견제 개발계획에   조원 투입한다,World
모더나 백신  남성 심근염 위험 높지만 돌파감염은 적어,World
기시다  분배정책  우선 대상 간호사 보육사 월급    오른다,World
 위키리크스  설립자 어산지  옥중 결혼식 올린다,World
중국 인민일보  반드시 통일   대만  자유민주 수호 ,World
 당 핵심   통일영도  장기집권 기반 다진 시진핑 미중관계  공동부유  대만 문제 등은 풀어야 할 과제,World
인도네시아 불륜녀  대중 앞에서   번 채찍질 영상 찍는 남자들,World
 영상   생존확률        주  일 만에 태어난 아기의 기적,World
리비안에 훈수 둔 머스크  진짜 시험은 대량생산 손익분기점 달성 ,World
 사이테크   기후위기 시대  공적  석탄 메탄  어떻게 만들어질까,World
 러시아가 우크라이나 침공할지도    다급한 외침에 EU 초긴장,World
 코로나 봉쇄는 노예제  백신저항 선봉에선 에릭 클랩턴,World
 네가 왜 여기에    남극 펭귄        헤엄쳐 뉴질랜드로,World
  연임  옹립식만 남은 시진핑  권위 위협할 대내외 난제는,World
  항소법원   의회폭동  백악관 문서 공개  일단 유예 ,World
헝가리  치솟는 에너지 값에 휘발유 경유값 상한제 도입,World
 서 한국인 남녀   외화벌이 혐의,World
디즈니도 올라탄 메타버스  가상 테마파크 시대  열릴까,World
베트남 인맥 총동원  막혔던 요소     톤 수입 길이 열렸다,World
 제재 땐 가스 끊겠다  벨라루스  EU에  으름장 ,World
간통죄로 채찍   대 맞은   쓰러졌다    공원서 공개 태형하는 이곳,World
 자민당  극우정당 유신회 접근    개헌 연대  모색하나  도쿄리포트 ,World
 World Now  중국  시진핑 새 시대  선언   년 만의  역사결의  의미는 ,World
 뉴스외전 뉴스 스토리  카자흐스탄  싼 전기료에 비트코인  채굴  성행,World
두테르테 딸 필리핀 대선 출마선언 초읽기   주말에 결정날 것 ,World
 위키리크스  어산지  영국서 옥중 결혼  이성의 승리 ,World
벨라루스  난민 밀어내기 공격 에 인권 딜레마 빠진 EU,World
  기시다  첫 내각 띄우고   일 만에 코로나 종합대책 결정,World
 남편 죽여달라     청부살인 사주   대  에  발칵 ,World
 솽스이  매출   조원 중국 보복소비 폭발,World
남극 사는 아델리 펭귄이 뉴질랜드에    천km 헤엄쳐 ,World
미 주택 쟁탈전 과열 매물 소화속도   주일  역대최단,World
 업무시간 외 연락금지 재택비용 지원  포르투갈 새 노동법 시행,World
 위키리크스  어산지    교도서에서 옥중 결혼식 올린다,World
호주에 핵잠 기술 지원은    좋은 동맹에 좋은 대접한 것 ,World
세계 수입식량 물가 역대 최고로 치솟아  애그플레이션 비상 ,World
시진핑 장기집권 선포 날  알리바바 빛바랜 최대 매출    조,World
 원래 코로나 바이러스 면역력 가진 사람도 있었다 ,World
영국 GDP 성장 둔화 G  국가 중 여전히 뒤쳐져,World
 줌인   오겜  덕에 위기 넘긴 넷플릭스  OTT 출혈경쟁 견딜까,World
 코로나  미접종자의 전염병  재확산    백신거부 에 뿔났다 영상 ,World
 시진핑 브레인   민주주의 서방 특허 아냐 ,World
 신냉전 안 돼  시진핑 경고에     선택권  에 있어 ,World
   시진핑  인 장기 집권 준비 완료   요란했던  쌍십일  할인행사도 뚝 ,World
 니가 왜 여기서  남극 사는 아델리 펭귄  뉴질랜드서 출현       km 헤엄,World
   년간 참전용사에 고마워하는 나라는 한국뿐 ,World
머스크  리비안 견제하나   대량생산 흑자달성이 관건 ,World
머스크  라이벌 리비안에 훈수  대량생산 흑자달성이 관건 ,World
모더나  우리 백신 심근염 위험  화이자  배 돌파감염보단 낫다 ,World
농구 중 한국계 소녀 때려눕힌 흑인  아버지 정체에 발칵  영상 ,World
일본도  위드 코로나  이제 회식 이벤트 인원제한 없어진다,World
 일본  출입금지  공고한 한국 골프장에   누리꾼들  잘한다 ,World
 광군제  공급망 대란 규제에 타격 역대 최저 성장률,World
 월드피플     세 노인   명문대 물리학 박사 취득 평생 꿈 이뤘다,World
TSMC 첫 공장에  조원 지원하는   정부 구상에 자국 내에서도 회의론,World
   대  교사    세 제자 아이 임신  충격적인 소문의 반전,World
CNBC  시진핑  베이징올림픽에 바이든 초청 가능성 커 ,World
중국 공산당  역사결의  초점  당    년  마오 덩 시진핑 시대 삼분,World
시진핑 화상회담 앞둔 바이든   화훼이 허가금지법  서명,World
일본   살 이하  재난지원금    만엔씩 지급 국민      부적절 ,World
   소득     오른 동안 집값은         코로나 기간  폭등 ,World
TSMC에  조원 지원  구상 논란  구형 생산 WTO 저촉 가능성 ,World
묻지도 따지지도 않고 사들여  주만에 집 팔린다는 미국,World
셀트리온 코로나 치료  유럽서  승인 권고  획득,World
대만  중국  통일론 은 진부해 수용 불가 ,World
마이니치  한일 관계 개선 위해 일본이 먼저 대화 자세 보여야 ,World
  시간 연속   m 눈폭탄   네이멍구   년만에 최악  온난화 폭풍 ,World
세계 수입식량 물가도 역대 최고로 치솟아 애그플레이션  비상 ,World
중국  쌍십일  쇼핑 축제  알리바바    조 매출   성장세 꺾여,World
인도  유독성 거품으로 뒤덮인  야무나 강 ,World
 취재N팩트     시진핑  인 장기 집권 준비 완료   달라지는 중국,World
  최대 반도체 파운드리 SMIC에 무슨 일  내홍 속 경영진 줄사퇴,World
 광군제  공급망 대란 규제에 타격 역대 최저 성장률,World
고 인플레에도   주가는 반등  영향 심각하지 않아 ,World
일본 개헌 세력  다수  힘 받은 기시다 총리 개헌  시동 ,World
중국   번째 역사결의  채택 시진핑   대 지도자  반열,World
   유럽에  러시아 우크라이나 침공 대비  경고 긴장 고조,World
대만  중국  중전회  통일론 은 진부한 논조 수용 못해 ,World
 요리법 바꿔야 할 처지  추수감사절 칠면조 대란  왜 ,World
독일 신규 확진  만 명 숄츠  더 강력한 조치 필요 ,World
 마이니치   대통령 움직이려면 일본이 먼저 나서라 ,World
유럽의약품청  한국산 코로나   치료제 승인 권고,World
  경기장 콘서트장  이르면   월말 정원      허용,World
 영상    억마리 중  마리  초희귀  파스텔 랍스터  잡혔다,World
 제재하면 가스 끊겠다  벨라루스  난민압박에 되레 EU 협박,World
승무원 가슴 밀치고 쓰레기 투척     기내소란   명에    억 벌금,World
 달의 파편이라고     지구 맴도는  카모오알레바 의 정체,World
가스부터 빵까지 전세계 인플레 우려 넘어  공포 ,World
 가서 때려  엄마 외침에 흑인 농구 선수  한국계 여학생 폭행  영상 ,World
 당기관지  조국통일  거스릴 수 없는 역사 흐름 ,World
  언론  한국 국적 남녀   공작원 지시로 일본에서 외화벌이 ,World
중국 동북 지역 폭설 몸살,World
중국발 요소 부족사태  전세계 식량대란 일으킬 수도,World
요소 부족 한국 운전자 인도 농민 위험에 빠트려,World
포르투갈   업무 외 시간 직원에 연락 금지  법제화,World
시위대에 총 쏜 백인 소년  법정 통곡 에 NBA스타  그만해  논란 영상 ,World
 유럽행 가스 끊겠다  벨라루스의 위협  왜 ,World
머스크  라이벌 리비안에 훈수  대량생산 흑자달성이 관건 ,World
바이든 예산  인플레 잡는다  전문가  내년까진 힘들다 ,World
중국    년 만에  역사결의  시진핑 장기집권 길 열었다,World
 전 세계 탄소    내뿜는 군수산업  기후위기 대응  구멍  ,World
유럽의약품청  셀트리온 코로나 치료제  렉키로나  승인 권고,World
 위드 코로나  전세계 확진자    가 유럽에서 각국  백신패스  강화,World
미  CPTPP 복귀에 등 돌렸나 USTR 대표   년도 더 된 서명 ,World
공보에  행백리자반구십  명시      연임   종신집권  야망 ,World
암표     만원   코로나 지구촌 위로  BTS  공연 열풍,World
 Why  월가 투자사들이 엔비디아 목표주가     넘게 올려잡은 이유,World
 모더나  심근염 발생 화이자의  배 인정 돌파감염은 적어 ,World
벨라루스  EU 추가 제재에  가스 운송 중단  위협  맞불 ,World
테슬라  전기차 후배 리비안에 충고  생산 손익분기점 관건 ,World
서유럽 코로나 확진 신기록 백신 미접종자  봉쇄  검토,World
위키리크스 설립자 어산지  영국 교도소서 옥중 결혼식 올린다,World
 아베   년여만에 정치전면 재등장   당내서도  나쁜 이미지  우려,World
신기록 갈아치우던 쌍십일        축제 올해는 조용하게 지나가,World
공급망 대란에 알리바바  광군제 특수 놓쳤다,World
 독일 코로나    차 확산은 백신 미접종자의 팬데믹 ,World
러 폭격기  혈맹  벨라루스 출격 루카셴코  핵사용 가능 폭격기 ,World
팬데믹 잊은 글로벌      명품 열풍  올해    조원 팔려  V자형  급반등,World
인플레 놓고 엇갈린 해법 백악관 경기부양 vs 연준 긴축,World
중국 인민일보  중국은 반드시 통일될 것 ,World
   초뉴스  중국 내몽골   년만에 최대 폭설  얼음도시로 변해 ,World
 Pick       년 만의 최악 폭설   시간 폭설에   시간 도보 출근 ,World
중 관영매체  공산당    년 하나의 기적  시진핑 영도 강조,World
 지구촌 날씨  중국 내몽골   년 만에 최대 폭설,World
 접종률      싱가포르  덴마크 입국때   일간 격리 왜 ,World
 지구촌 Talk  이스라엘  썰매 대신 배 타고 온 산타클로스,World
 지구촌 IN  러시아인들  백신 여행  급증  자국 백신 무용 ,World
 차기 총리  확진자  만명에도  이달말 비상사태 해제  고수,World
오스트리아    일부터 백신 미접종자만 봉쇄 가능성,World
 갈까 말까  시진핑  베이징올림픽에 바이든 초청할 듯,World
   만명 투자했는데  코인은 도박  암호화폐 금지한 이슬람,World
미국  유가 급상승에도 대응 수단 한계 기후변화 대응 앞세운 바이든 정부의 딜레마,World
 World Now  COP    석탄 퇴출  합의 무산   중 러 인도 반대 ,World
중국   번째 역사결의  채택 시진핑   대 지도자  반열,World
   대학생까지 동원해  독도는 우리 것  홍보 서경덕  어리석은 짓 ,World
 World Now 영상   몸무게    g  세계에서 가장 빨리 태어난  가장 작은 아기,World
EU 러시아 일촉즉발    러  우크라이나 침공할수도 ,World
EU  난민 밀어내기  제재 경고에  벨라루스  유럽행 가스관 끊겠다  위협,World
중국  남중국해 탐사 강화 하이난성에 과학연구용 부두 건설,World
시진핑의 중국몽    구국 흥국 부국에 이어  G  ,World
  분은 안 넘기려 했는데     살 할머니    m   초로 우승,World
 영상  셀트리온 코로나 치료제  렉키로나  유럽서 승인 권고,World
모더나  심근염 위험 화이자의  배 돌파감염은 더 적어 ,World
 간통죄로   대 채찍질 당한 여성 쓰러져  공원서 공개 태형,World
필리핀 두테르테 딸 대선 출마     새로운 정당 입당 ,World
인도네시아 이슬람최고기구  무슬림의 가상화폐 통화사용 금지 ,World
폐막 앞둔 COP    중 러 인도 반대에 석탄퇴출합의 막판진통 ,World
바이든  화웨이 제품 허가하지 않겠다  국가 안보 이유,World
부스터 접종 확대하는 미국  캘리포니아 콜로라도  모든 성인에 허용,World
바이든의 복지예산     조원  인플레에 발목 잡혀,World
바이든    년만의 최고 인플레이션으로 시험에 들다,World
 점슛 실패하자  퍽  전 NBA 선수 딸  한국계 여학생에 화풀이 영상 ,World
 매체     위드코로나 후 위중증 환자 늘어  정부대응 비판,World
 머스크   월에 이미 테슬라 주식 매각 계획 설문으로 세금 줄여 ,World
인플레 심화에 바이든 복지예산 위기 공화당  끔찍한 정책  맹공,World
  국적 남녀    공작원 지시로 일본에서 외화벌이 ,World
    년 태어난 미국 할머니    m를   초에   분 안 넘기려 했는데 ,World
악어에 물린 채 강물로 끌려간   대  맥가이버칼이 살렸다,World
 위키리크스 설립자  어산지  내달 옥중 결혼식 올린다   승인,World
 위키리크스  설립자 어산지   옥중 결혼식  올린다,World
   세에 시작한    m 달리기  세계기록 세운  꽃할매 ,World
자민당  개헌 위해 일본유신회 국민민주당과 손잡나,World
    역사 결의 로 시진핑 연임 토대 마련    미중 대립 공동 부유 가속화 ,World
 개인에 맞춤화된 호주 커피문화  스벅 공화국  한국에 알리고 싶어 ,World
셀트리온 항체치료제  렉키로나   유럽서 사실상 허가,World
서유럽 곳곳 코로나 확진 신기록 백신 미접종자  록다운  검토,World
   국적 남녀    공작원 지시로 일본에서 외화벌이 ,World
유럽의약품청  한국산 코로나   치료제 승인 권고,World
 위키리크스  어산지  옥중에서 결혼식 올린다,World
아마존의 독점시장 된 미국  온라인 개미지옥 ,World
   대학생까지 동원해 독도 영유권 주장   서경덕  어리석은 짓 ,World
 점슛 실패하자  퍽  전 NBA 선수 딸  한국계 여학생에 화풀이 영상 ,World
공급망 대란에 중국 알리바바 쌍십일 쇼핑축제도  위축 ,World
중국 동북 지역 폭설 몸살,World
 자막뉴스   심근염 발생 화이자의  배  하지만     모더나 CMO가 밝힌 내용,World
 김지수의 글로벌브리핑  시진핑  장기 집권 길 열어   대 지도자  반열에,World
 나이는 숫자일뿐       세 할머니의 질주,World
볼턴 전 보좌관  트럼프  패배 두려워 차기 대선 안나갈 것 ,World
백악관 안보보좌관  미국에 베팅하라     포위망 동참 촉구,World
   대 지도자 반열 오른    공동부유         미중 패권  과제 직면,World
   살 미국 할머니의    m 질주   분은 안 넘기려 했는데 ,World
볼턴  트럼프  대선 재출마 시사는 관심 끌기 전략 결국 패배 두려워 안나갈 것 ,World
모더나 백신  젊은 남성 심근염 위험 화이자의  배,World
머스크  이번주 테슬라 주식  조원어치 처분,World
모더나   화이자 백신에 비해 돌파감염 낮다 ,World
마피아 소행    시칠리아 활화산 동굴서 수십년 된 유해 발견,World
 마오 덩 반열에 오른 시진핑  최대 도전은 본인 ,World
미  중국과 냉전 아닌 경쟁 좋은 동맹에 좋은 대접 ,World
 두 딸 총살 기억에 아파  영국서 함께 눈물 흘린 남북 여성들,World
 난민 사태  벨라루스  유럽행 가스 끊겠다  위협 푸틴은  뒷짐 ,World
볼턴 전 보좌관  트럼프  패배 두려워 차기 대선 안 나갈 것 ,World
벨라루스 가스공급 차단 위협   벨라루스발 천연가스 대란 오나,World
    세대 주도 올 세계 명품 판매    조원  V자 회복 에 팬데믹 전 수준 넘어,World
셀트리온 코로나 치료제  렉키로나   유럽서  승인 권고  획득 종합 보 ,World
남아공 마지막 백인 대통령 데 클레르크 별세   만델라와 노벨평화상 공동수상,World
모더나  심근염 발생 위험 인정   화이자보다  배 높다 ,World
시위대에 총 쏜   대 백인 청소년  울먹이며  정당방위다 ,World
머스크  이번주 팔아 치운 테슬라 주식만  조원 육박,World
  금 최고 흥행작  조커     퇴출 수순  지하철 칼부림 때문   영상 ,World
 제 의 테슬라  리비안  이틀새    대 폭등 창업자  돈방석 ,World
독일  신규 확진  만여 명  최다    이웃 국가도 확산세 악화,World
 제  테슬라  리비안  또     넘게 급등,World
모더나 백신  심근염 위험 화이자  배  돌파감염은 더 적다 ,World
  정부 빅테크 규제에도 광군제 매출    조원  사상 최대 ,World
중국 역사결의 시진핑  연임 장기집권 기반 마련,World
비대면 연설 중  엄마  아던 총리 연설 중단 시킨 귀여운 방해꾼,World
볼턴 전 보좌관  트럼프  패배 두려워 차기 대선 안나갈 것 ,World
모더나 임원    세 미만  심근염 확률  모더나가 화이자의  배 ,World
EU 경제  에너지 가격 상승에 타격 코로나   재확산 우려  글로벌 이슈 ,World
  월   일 미국증시 특징주,World
 연방법원   의회폭동  백악관 문서 공개  일단 유예 ,World
 전력난 반도체 위기 공급망 붕괴  중고    광군제 분위기 냉랭,World
바이든표 사회복지 기후변화 예산  인플레이션에 발목 잡혔다,World
유럽이 어쩌다 코로나 진앙지로 부스터샷 등 백신에 사활,World
알리바바 쌍십일    조 매출  역대 최대  성장세는 꺾여,World
셀트리온 코로나 치료제 렉키로나  유럽 승인 관문 넘었다,World
중동 난민 폴란드 국경에 내몬 벨라루스  유럽행 가스 잠글 수도 ,World
리비안 또     폭등   세 창업자  이틀 만에    조원 돈방석,World
 마크롱 해리스  오커스 잠수함 사태 논의 안했다 ,World
중국 네이멍구   년 만의 최대 폭설 동북지방 피해 속출,World
 인플레 둔화의 창 닫히고 있어    물가의 정치경제학  김영필의  분 월스트리트 ,World
유럽  셀트리온 코로나 항체치료제 사실상 허가 EMA 승인 권고,World
미  미중 경쟁  신냉전으로 안 갈 수 있다 ,World
독일 신규 확진  만 명 넘었다 하루 만에  만 명 ,World
코로나 시대의 싱글남  잠자리는 더 이상 중요하지 않아 ,World
 이 시각 세계  인도네시아서 불륜 남녀에 공개 태형,World
 인더머니  뉴욕 증시 혼조세 유가는 지속 상승,World
모더나  심근염 위험 화이자의  배 돌파감염은 적다 ,World
 정부 규제도 못 막은 클릭 광풍   광군제 매출    조원 역대 최대,World
모더나  심근염 발생 화이자의   배   돌파감염은 적다 ,World
 중국은  왜  시간에 쫓기는    대만 침공에 베팅할 수 있을까,World
모더나 코로나   백신  심근염 발생 화이자의  배,World
 코로나   국제뉴스  독일 신규 확진  만 명 숄츠  더 강력한 조치 필요 ,World
오스트리아 일부 백신 미접종자 봉쇄  신규 확진  만     명 가까이,World
 뉴욕마감 지수별 혼조  재향군인의 날  맞아 거래량 저조,World
바이든  다음주 GM 전기차 공장 방문 팩토리 제로 가동식,World
 이슈톡    년 만에 최대 폭설   내몽골  얼음도시 로 변해,World
보잉사 이디오피아 항공기 추락사고 책임 인정,World
일본 개헌 세력  다수  힘 받은 기시다 총리 개헌  시동 ,World
중국   번째 역사결의  채택 시진핑   대 지도자  반열,World
 시진핑  정상회담서 바이든 베이징올림픽에 초청할 듯 ,World
비트코인 사상최고치 찍은 뒤  만    달러대로 급락 상보 ,World
모더나 백신  젊은 남성 심근염 발생 위험 화이자의  배,World
대마초에 사우나 서비스  백신 접종에 사활 건 나라들,World
리비안 이틀간     이상 폭등  시총     억 달러 돌파 종합 ,World
중국    년만에  역사결의  시진핑 장기집권 준비 완료,World
뉴욕증시 혼조세 마감  다우 하락  S P    나스닥 상승,World
마오쩌둥 덩샤오핑 반열에 장기집권 길 열어,World
나스닥  하락 뒤          리비안은       폭등  데일리 국제금융시장 ,World
유럽의약품청  한국산 코로나   치료제 승인 권고,World
테슬라 대항마 리비안 전일     이어 또     폭등 상보 ,World
모더나 코로나   백신  심근염 발생 화이자의  배,World
 속보  뉴욕 증시  인플레 우려에 혼조 마감   다우        나스닥       ,World
  기내서 소란 피우면  벌금폭탄   천   만원 부과된 사례도,World
 주식 팔까요  설문 찬성 높자  머스크     만주 진짜 팔았다,World
시진핑 주석 장기집권 위한 역사 결의 채택  내년  연임 옹립식,World
중국 공산당 세번째 역사결의 시진핑  연임 공고화,World
국제우주정거장  중국 우주쓰레기 피하긴 했는데 아직     개 남았다,World
중국 올해 광군제 매출액     조원 사상최고   전년비       ,World
유럽EMA 자문위  셀트리온 코로나 치료제 승인 권고,World
모더나 백신  심근염 발생 화이자의  배    돌파감염은 적다 ,World
